{
  "schema_version": "1.0",
  "simulation_id": "result_verified_lending_2026_10_10_depeg",
  "request_id": "verified_lending_2026_10_10_depeg",
  "portfolio_id": "verified_lending_2026_10_10_portfolio",
  "scenario_id": "usde_depeg",
  "horizon_days": 7,
  "currency": "USD",
  "positions": [
    {
      "position_id": "lend_susde_01",
      "gross_value_before_usd": "5000335.00",
      "gross_value_after_usd": "4538180.24",
      "executable_value_after_usd": null,
      "debt_after_usd": "0.00",
      "net_equity_before_usd": "5000335.00",
      "net_equity_after_usd": "4538180.24",
      "conditional_loss_usd": "462154.76",
      "loss_components": {
        "market_repricing": "0.00",
        "backing_impairment": "0.00",
        "liquidation_penalty": "0.00",
        "execution_haircut": "0.00",
        "bad_debt": "462154.76",
        "undercollateralized_debt": "0.00"
      },
      "risk_metric": null,
      "source_type": "derived",
      "calculation_status": "computed",
      "warnings": [
        "Lender share 4.59% of the market; 100% of borrower debt becomes liquidatable (sUSDe oracle pass-through 1).",
        "Linked to asset:USDe (usde_price) through the graph; no lender loss at this scenario size (it starts only once borrowers' collateral stops covering their debt)."
      ],
      "contagion": {
        "paths": [
          {
            "factor": "usde_price",
            "root": "asset:USDe",
            "nodes": [
              "position:lend_susde_01",
              "market:lend_susde_01",
              "asset:sUSDe",
              "asset:USDe"
            ],
            "edges": [
              "edge:5",
              "edge:6",
              "edge:3"
            ],
            "channels": [
              "borrower_default",
              "mark_to_market",
              "exchange_rate"
            ],
            "confidence": "verified",
            "unverified_edges": []
          },
          {
            "factor": "usde_price",
            "root": "asset:USDe",
            "nodes": [
              "position:lend_susde_01",
              "market:lend_susde_01",
              "oracle:lend_susde_01",
              "asset:USDe"
            ],
            "edges": [
              "edge:5",
              "edge:8",
              "edge:12"
            ],
            "channels": [
              "borrower_default",
              "oracle_repricing",
              "oracle_repricing"
            ],
            "confidence": "verified",
            "unverified_edges": []
          },
          {
            "factor": "usde_price",
            "root": "asset:USDe",
            "nodes": [
              "position:lend_susde_01",
              "market:lend_susde_01",
              "oracle:lend_susde_01",
              "asset:sUSDe",
              "asset:USDe"
            ],
            "edges": [
              "edge:5",
              "edge:8",
              "edge:11",
              "edge:3"
            ],
            "channels": [
              "borrower_default",
              "oracle_repricing",
              "exchange_rate",
              "exchange_rate"
            ],
            "confidence": "verified",
            "unverified_edges": []
          }
        ],
        "evidence_confidence": "verified",
        "graph_gaps": [],
        "unmodeled_exposures": []
      }
    },
    {
      "position_id": "lend_usde_01",
      "gross_value_before_usd": "3000066.00",
      "gross_value_after_usd": "2688040.31",
      "executable_value_after_usd": null,
      "debt_after_usd": "0.00",
      "net_equity_before_usd": "3000066.00",
      "net_equity_after_usd": "2688040.31",
      "conditional_loss_usd": "312025.69",
      "loss_components": {
        "market_repricing": "0.00",
        "backing_impairment": "0.00",
        "liquidation_penalty": "0.00",
        "execution_haircut": "0.00",
        "bad_debt": "312025.69",
        "undercollateralized_debt": "0.00"
      },
      "risk_metric": null,
      "source_type": "derived",
      "calculation_status": "computed",
      "warnings": [
        "Lender share 6.00% of the market; 100% of borrower debt becomes liquidatable (USDe oracle pass-through 1).",
        "Linked to asset:USDe (usde_price) through the graph; no lender loss at this scenario size (it starts only once borrowers' collateral stops covering their debt)."
      ],
      "contagion": {
        "paths": [
          {
            "factor": "usde_price",
            "root": "asset:USDe",
            "nodes": [
              "position:lend_usde_01",
              "market:lend_usde_01",
              "asset:USDe"
            ],
            "edges": [
              "edge:13",
              "edge:14"
            ],
            "channels": [
              "borrower_default",
              "mark_to_market"
            ],
            "confidence": "verified",
            "unverified_edges": []
          },
          {
            "factor": "usde_price",
            "root": "asset:USDe",
            "nodes": [
              "position:lend_usde_01",
              "market:lend_usde_01",
              "oracle:lend_usde_01",
              "asset:USDe"
            ],
            "edges": [
              "edge:13",
              "edge:16",
              "edge:19"
            ],
            "channels": [
              "borrower_default",
              "oracle_repricing",
              "oracle_repricing"
            ],
            "confidence": "verified",
            "unverified_edges": []
          }
        ],
        "evidence_confidence": "verified",
        "graph_gaps": [],
        "unmodeled_exposures": []
      }
    }
  ],
  "portfolio": {
    "net_equity_before_usd": "8000401.00",
    "net_equity_after_usd": "7226220.55",
    "total_conditional_loss_usd": "774180.45",
    "shared_liquidity_penalty_usd": "0.00",
    "aggregation_status": "complete"
  },
  "provenance": {
    "model_version": "risk-v0.1",
    "input_snapshot_id": "snapshot_verified_lending_2026_10_10",
    "input_graph_id": "graph_verified_lending_2026_10_10"
  },
  "warnings": [],
  "contagion": {
    "graph_id": "graph_verified_lending_2026_10_10",
    "hubs": [
      {
        "node": "asset:USDe",
        "label": "USDe",
        "node_type": "asset",
        "positions": [
          "lend_susde_01",
          "lend_usde_01"
        ],
        "gross_exposure_usd": "8000000.00",
        "net_equity_usd": "8000000.00"
      },
      {
        "node": "offchain:ethena_backing",
        "label": "Ethena backing (custody, hedges, reserve fund)",
        "node_type": "offchain_entity",
        "positions": [
          "lend_susde_01",
          "lend_usde_01"
        ],
        "gross_exposure_usd": "8000000.00",
        "net_equity_usd": "8000000.00"
      },
      {
        "node": "protocol:ethena",
        "label": "Ethena",
        "node_type": "protocol",
        "positions": [
          "lend_susde_01",
          "lend_usde_01"
        ],
        "gross_exposure_usd": "8000000.00",
        "net_equity_usd": "8000000.00"
      },
      {
        "node": "protocol:morpho",
        "label": "Morpho Blue",
        "node_type": "protocol",
        "positions": [
          "lend_susde_01",
          "lend_usde_01"
        ],
        "gross_exposure_usd": "8000000.00",
        "net_equity_usd": "8000000.00"
      }
    ],
    "warnings": []
  }
}
